<?xml version="1.0" encoding="UTF-8"?>
<!ELEMENT students (student+)>
<!ELEMENT student (num,name,email,marks,class)>
<!ELEMENT num (#PCDATA)>
<!ELEMENT name (#PCDATA)>
<!ELEMENT email (#PCDATA)>
<!ELEMENT marks (#PCDATA)>
<!ELEMENT class (#PCDATA)>
<!ATTLIST student sid ID #REQUIRED>